{
  "schema_version": "1.0.0",
  "snapshot_date": "2026-09-19",
  "method_version": "1.0.0",
  "evidence_window": {
    "start_date": "2026-08-21",
    "end_date": "2026-09-19",
    "days": 30
  },
  "trends": [
    {
      "trend_id": "dab-trend-agent-reliability-governance",
      "name": "Agent reliability and governance",
      "classification": "stable",
      "confidence": "high",
      "rationale": "28 supporting stories appeared in the latest 7 days and 69 in the preceding 23 days. Classification follows normalized story frequency and remains an editorial signal, not a forecast.",
      "evidence_counts": {
        "recent_7_days": 28,
        "preceding_days": 69,
        "total": 97
      },
      "supporting_story_ids": [
        "dab-story-2026-09-18-2cda8d5e",
        "dab-story-2026-09-18-c5d22f27",
        "dab-story-2026-09-17-1a7c4e90",
        "dab-story-2026-09-17-2b8d5f01",
        "dab-story-2026-09-17-4daf7b23",
        "dab-story-2026-09-17-5eb08c34",
        "dab-podcast-2026-09-17-judgment-models",
        "dab-story-2026-09-16-9f13a2c7",
        "dab-story-2026-09-16-c4b86e10",
        "dab-story-2026-09-16-7e31bc48",
        "dab-story-2026-09-16-5bc218ad",
        "dab-podcast-2026-09-16-frontier-pacing",
        "dab-story-2026-09-15-b7d4e8a1",
        "dab-story-2026-09-15-d8e1b5c7",
        "dab-story-2026-09-15-e3a7d2f9",
        "dab-story-2026-09-15-f4b8c1e6",
        "dab-podcast-2026-09-15-ai-show-237",
        "dab-story-2026-09-14-2e7b9d40",
        "dab-story-2026-09-14-f5d208be",
        "dab-story-2026-09-14-74b1ea3c",
        "dab-story-2026-09-14-c09e57d2",
        "dab-video-2026-09-14-general",
        "dab-podcast-2026-09-14-bank-ai-transformation",
        "dab-story-2026-09-13-91c7e2a4",
        "dab-story-2026-09-13-4b8f13d0",
        "dab-story-2026-09-13-d30a5f8b",
        "dab-story-2026-09-13-f7b1249e",
        "dab-story-2026-09-13-28e6c5ad",
        "dab-story-2026-09-12-4f7c9a21",
        "dab-story-2026-09-12-f0397b5d",
        "dab-podcast-2026-09-12-ai-risk-specificity",
        "dab-story-2026-09-11-d957d6c9",
        "dab-story-2026-09-11-80fe8cea",
        "dab-story-2026-09-11-53dc2a82",
        "dab-story-2026-09-10-415f8f1a",
        "dab-story-2026-09-10-fdde2a0c",
        "dab-podcast-2026-09-10-twiml-tokenomics",
        "dab-story-2026-09-09-e9be6ec5",
        "dab-story-2026-09-09-a02b9db1",
        "dab-podcast-2026-09-09-agentic-loops",
        "dab-story-2026-09-08-aad4e966",
        "dab-story-2026-09-08-9061ff44",
        "dab-story-2026-09-07-3f4df523",
        "dab-story-2026-09-07-dab4bc85",
        "dab-story-2026-09-07-8053a573",
        "dab-story-2026-09-07-379d301c",
        "dab-story-2026-09-06-4426ca30",
        "dab-story-2026-09-06-9839a69b",
        "dab-story-2026-09-06-3f824b7a",
        "dab-story-2026-09-05-a956fc27",
        "dab-story-2026-09-05-d26b77c9",
        "dab-story-2026-09-05-9c2ab12f",
        "dab-story-2026-09-04-dfb80844",
        "dab-story-2026-09-04-687d1566",
        "dab-story-2026-09-03-9e81e5ce",
        "dab-story-2026-09-03-a001445a",
        "dab-story-2026-09-03-1cda360c",
        "dab-story-2026-09-02-ad64fbde",
        "dab-story-2026-09-02-d4186454",
        "dab-story-2026-09-02-6dc5626e",
        "dab-story-2026-09-01-4df260d4",
        "dab-story-2026-09-01-c324f577",
        "dab-story-2026-08-31-ae8493a1",
        "dab-story-2026-08-31-f97bd21f",
        "dab-story-2026-08-30-7712bd8b",
        "dab-story-2026-08-30-6c8007e6",
        "dab-story-2026-08-30-71d505c2",
        "dab-story-2026-08-30-6649fb3e",
        "dab-story-2026-08-29-da2869d0",
        "dab-story-2026-08-29-74777276",
        "dab-story-2026-08-29-67aff0e3",
        "dab-story-2026-08-29-b98b5a80",
        "dab-story-2026-08-28-00afae1b",
        "dab-story-2026-08-28-633f53c9",
        "dab-story-2026-08-27-2fe3956c",
        "dab-story-2026-08-27-5e4d5095",
        "dab-story-2026-08-26-b03e2253",
        "dab-story-2026-08-26-9271a92d",
        "dab-story-2026-08-26-893a3c2c",
        "dab-story-2026-08-26-48060fd1",
        "dab-story-2026-08-25-a653e831",
        "dab-story-2026-08-25-b52263f4",
        "dab-story-2026-08-24-f58c2c99",
        "dab-story-2026-08-24-4517141d",
        "dab-story-2026-08-24-fb9e9c08",
        "dab-story-2026-08-24-db55e747",
        "dab-story-2026-08-23-b2a17ab9",
        "dab-story-2026-08-23-be5593e7",
        "dab-story-2026-08-23-40885c98",
        "dab-story-2026-08-23-dbdd1c3a",
        "dab-story-2026-08-22-fe121e20",
        "dab-story-2026-08-22-88a696d2",
        "dab-story-2026-08-22-d6deaef1",
        "dab-story-2026-08-21-92a6e1fe",
        "dab-story-2026-08-21-2e9487fe",
        "dab-story-2026-08-21-eeb92c90",
        "dab-story-2026-08-21-6877cf6f"
      ],
      "supporting_stories": [
        {
          "story_id": "dab-story-2026-09-18-2cda8d5e",
          "brief_date": "2026-09-18",
          "url": "/stories/2026-09-18/anthropic-proposes-three-measurements-for-ai-self-acceleration-inside-frontier-labs/"
        },
        {
          "story_id": "dab-story-2026-09-18-c5d22f27",
          "brief_date": "2026-09-18",
          "url": "/stories/2026-09-18/salesforce-makes-builder-central-a-natural-language-front-door-for-governed-apps-and-agents/"
        },
        {
          "story_id": "dab-story-2026-09-17-1a7c4e90",
          "brief_date": "2026-09-17",
          "url": "/stories/2026-09-17/openai-builds-a-standing-misalignment-disclosure-process/"
        },
        {
          "story_id": "dab-story-2026-09-17-2b8d5f01",
          "brief_date": "2026-09-17",
          "url": "/stories/2026-09-17/llamaindex-treats-extraction-schemas-as-semantic-contracts/"
        },
        {
          "story_id": "dab-story-2026-09-17-4daf7b23",
          "brief_date": "2026-09-17",
          "url": "/stories/2026-09-17/github-makes-copilot-budget-increases-a-governed-request/"
        },
        {
          "story_id": "dab-story-2026-09-17-5eb08c34",
          "brief_date": "2026-09-17",
          "url": "/stories/2026-09-17/zocks-adds-a-reusable-financial-planning-agent-skill/"
        },
        {
          "story_id": "dab-podcast-2026-09-17-judgment-models",
          "brief_date": "2026-09-17",
          "url": "/podcasts/2026-09-17/judgment-models/"
        },
        {
          "story_id": "dab-story-2026-09-16-9f13a2c7",
          "brief_date": "2026-09-16",
          "url": "/stories/2026-09-16/google-moves-agent-security-to-runtime-intent-controls/"
        },
        {
          "story_id": "dab-story-2026-09-16-c4b86e10",
          "brief_date": "2026-09-16",
          "url": "/stories/2026-09-16/cloudflare-scopes-access-to-individual-workers/"
        },
        {
          "story_id": "dab-story-2026-09-16-7e31bc48",
          "brief_date": "2026-09-16",
          "url": "/stories/2026-09-16/copilot-suggests-repository-governance-taxonomies/"
        },
        {
          "story_id": "dab-story-2026-09-16-5bc218ad",
          "brief_date": "2026-09-16",
          "url": "/stories/2026-09-16/anthropic-marketplace-adds-informatica-governed-catalog-skill/"
        },
        {
          "story_id": "dab-podcast-2026-09-16-frontier-pacing",
          "brief_date": "2026-09-16",
          "url": "/podcasts/2026-09-16/frontier-pacing/"
        },
        {
          "story_id": "dab-story-2026-09-15-b7d4e8a1",
          "brief_date": "2026-09-15",
          "url": "/stories/2026-09-15/microsoft-publishes-a-draft-control-contract-for-mai-models/"
        },
        {
          "story_id": "dab-story-2026-09-15-d8e1b5c7",
          "brief_date": "2026-09-15",
          "url": "/stories/2026-09-15/github-shows-how-marketing-operations-can-run-as-reviewed-code/"
        },
        {
          "story_id": "dab-story-2026-09-15-e3a7d2f9",
          "brief_date": "2026-09-15",
          "url": "/stories/2026-09-15/an-open-agent-skills-library-adds-verification-gates-and-restartable-workflows/"
        },
        {
          "story_id": "dab-story-2026-09-15-f4b8c1e6",
          "brief_date": "2026-09-15",
          "url": "/stories/2026-09-15/salesforce-campaign-agent-turns-a-marketing-goal-into-a-reviewed-plan/"
        },
        {
          "story_id": "dab-podcast-2026-09-15-ai-show-237",
          "brief_date": "2026-09-15",
          "url": "/podcasts/2026-09-15/ai-show-237/"
        },
        {
          "story_id": "dab-story-2026-09-14-2e7b9d40",
          "brief_date": "2026-09-14",
          "url": "/stories/2026-09-14/google-cloud-plugin-packages-reusable-agent-skills/"
        },
        {
          "story_id": "dab-story-2026-09-14-f5d208be",
          "brief_date": "2026-09-14",
          "url": "/stories/2026-09-14/chatgpt-work-data-agent-connects-questions-to-governed-action/"
        },
        {
          "story_id": "dab-story-2026-09-14-74b1ea3c",
          "brief_date": "2026-09-14",
          "url": "/stories/2026-09-14/microsoft-turns-conversation-into-governed-business-apps/"
        },
        {
          "story_id": "dab-story-2026-09-14-c09e57d2",
          "brief_date": "2026-09-14",
          "url": "/stories/2026-09-14/salesforce-frames-agents-as-long-running-job-systems/"
        },
        {
          "story_id": "dab-video-2026-09-14-general",
          "brief_date": "2026-09-14",
          "url": "/videos/2026-09-14/general/"
        },
        {
          "story_id": "dab-podcast-2026-09-14-bank-ai-transformation",
          "brief_date": "2026-09-14",
          "url": "/podcasts/2026-09-14/bank-ai-transformation/"
        },
        {
          "story_id": "dab-story-2026-09-13-91c7e2a4",
          "brief_date": "2026-09-13",
          "url": "/stories/2026-09-13/ruby-build-pipeline-exposes-agent-containment-gap/"
        },
        {
          "story_id": "dab-story-2026-09-13-4b8f13d0",
          "brief_date": "2026-09-13",
          "url": "/stories/2026-09-13/bengio-explains-agent-deception-as-goal-optimization/"